{
  "schemaVersion": "1.0",
  "storage": "postgres",
  "incidentId": "22222222-2222-2222-2222-222222222222",
  "query": {
    "version": 1,
    "from": 1790208000,
    "till": 1790294400,
    "asOf": "2026-09-25T00:01:00Z",
    "source": "",
    "eventId": "",
    "after": null,
    "limit": 25
  },
  "coverage": "retained-normalized-current-ownership",
  "gaps": [
    "PRE_RETENTION_HISTORY_UNAVAILABLE",
    "VENDOR_RAW_PAYLOAD_NOT_RETAINED"
  ],
  "items": [
    {
      "schemaVersion": "1.0",
      "id": "1fe837a4-3c86-3034-8f05-52232cedb339",
      "observation": {
        "schemaVersion": "1.0",
        "tenantId": "tenant-demo",
        "sourceInstanceId": "zabbix-1",
        "problemEventId": "30001",
        "triggerId": "40001",
        "title": "Fixture: CPU threshold exceeded",
        "severity": 3,
        "occurredAt": "2026-09-21T12:00:00Z",
        "observedAt": "2026-09-25T00:00:00Z",
        "hostIds": [
          "10084"
        ],
        "suppressed": false,
        "recoveryEventId": "30003",
        "recoveredAt": "2026-09-21T12:10:00Z",
        "state": "RECOVERED",
        "gaps": []
      },
      "dataMode": "labeled-fixture",
      "sourceContract": "zabbix-7.0-event-v1",
      "firstReceivedAt": "2026-09-25T00:00:01.123456789Z",
      "entities": [
        {
          "hostId": "10084",
          "entityId": "11111111-1111-1111-1111-111111111111"
        }
      ],
      "gaps": []
    }
  ],
  "nextCursor": null
}
